{
  "format": "hyper-automation-take",
  "format_version": 1,
  "id": "018f47a2-6b2d-7c11-8a44-001122334479",
  "project_id": "018f47a2-6b2d-7c11-8a44-001122334455",
  "name": "Mixer pass 1",
  "enabled": true,
  "captured_at_utc": "2026-07-27T12:05:00.000Z",
  "start_tick": 0,
  "end_tick": 7680,
  "lanes": [
    {
      "id": "018f47a2-6b2d-7c11-8a44-001122334480",
      "target": {
        "kind": "mixer-channel",
        "track_id": "018f47a2-6b2d-7c11-8a44-001122334456",
        "parameter": "gain"
      },
      "interpolation": "linear",
      "points": [
        { "tick": 0, "value": 0 },
        { "tick": 3840, "value": 1000000 },
        { "tick": 7679, "value": 2000000 }
      ]
    },
    {
      "id": "018f47a2-6b2d-7c11-8a44-001122334481",
      "target": {
        "kind": "mixer-channel",
        "track_id": "018f47a2-6b2d-7c11-8a44-001122334456",
        "parameter": "mute"
      },
      "interpolation": "hold",
      "points": [
        { "tick": 0, "value": false },
        { "tick": 5760, "value": true }
      ]
    }
  ],
  "extensions": {}
}
